rate,tittle,link,content_intro,author_intro
  ,艺术社会史,https://book.douban.com/subject/25962831/,"阿诺尔德?豪泽尔是匈牙利艺术史家，艺术社会学家的创始人之一，与卢卡奇、阿多诺并称为“20世纪最重要的文化社会学家”。《艺术社会史》在豪泽尔的著述中享有核心地位，它是豪泽尔的第一部著作，此后的四本著作都是对这部著作的补充、总结和提炼。1979年，该书被收录于《艺术社会学经典》中。社会学家克里斯蒂安?格诺伊斯（Christian Gneuss）把《艺术社会史》比作“启示录”，称赞该书促使人们再度关注“宏观历史问题”。,本书不仅对从石器时代到20世纪初的欧洲艺术发展史进行了笔酣墨饱的勾勒和阐释，讨论了包括造型艺术、文学、音乐、建筑、戏剧、电影、综艺演出在内的形形色色的艺术现象，更为重要的是，系统地将跨学科方法应用于艺术史研究，对各种艺术现象进行跨学科的考察和分析，在哲学、美学、宗教学、经济学、社会学、思想史、文化史、心理分析、电影理论等十来个领域纵横捭阖、...,阿诺尔德?豪泽尔是匈牙利艺术史家，艺术社会学家的创始人之一，与卢卡奇、阿多诺并称为“20世纪最重要的文化社会学家”。《艺术社会史》在豪泽尔的著述中享有核心地位，它是豪泽尔的第一部著作，此后的四本著作都是对这部著作的补充、总结和提炼。1979年，该书被收录于《艺术社会学经典》中。社会学家克里斯蒂安?格诺伊斯（Christian Gneuss）把《艺术社会史》比作“启示录”，称赞该书促使人们再度关注“宏观历史问题”。,本书不仅对从石器时代到20世纪初的欧洲艺术发展史进行了笔酣墨饱的勾勒和阐释，讨论了包括造型艺术、文学、音乐、建筑、戏剧、电影、综艺演出在内的形形色色的艺术现象，更为重要的是，系统地将跨学科方法应用于艺术史研究，对各种艺术现象进行跨学科的考察和分析，在哲学、美学、宗教学、经济学、社会学、思想史、文化史、心理分析、电影理论等十来个领域纵横捭阖、来回穿梭，为艺术史研究开辟了前所未有的广阔视野。",[匈] 阿诺尔德・豪泽尔
 7.8 ,西夏旅馆,https://book.douban.com/subject/5423772/,"骆以军  台湾中生代最重要的小说家,耗时四年倾力书写一部关于异族人、变形者的疯癫、妖艳、镜中幻城的恶魔之书,王安忆  莫言  梁文道  戴立忍  桂纶镁  跨界鼎力推荐,《西夏旅馆》是台湾中生代小说家骆以军迄今为止最为重要的作品，作者写作期间曾三度遭受忧郁症侵袭，最终耗时四年，倾力写就一部关于异族人、变形者的创伤与救赎、离散与追寻的疯癫、妖艳之书。,2010年，《西夏旅馆》荣获华文世界奖金最高的文学奖项“红楼梦奖”首奖，复旦大学陈思和教授在颁奖词中如此陈述：《西夏旅馆》以十一世纪神秘消失的西夏王朝作为历史托喻，以一座颓废怪诞的旅馆作为空间符号，写出一部关于创伤与救赎、离散与追寻的传奇故事。骆以军糅合私密告白与国族叙事，魔幻现实与情欲臆想，黑色幽默与感伤格调，铺陈现代中国经验最复杂的面貌。全书试探文学想象的禁区、人间伦理关系的极限，尤其值得瞩目。《西夏...,骆以军  台湾中生代最重要的小说家,耗时四年倾力书写一部关于异族人、变形者的疯癫、妖艳、镜中幻城的恶魔之书,王安忆  莫言  梁文道  戴立忍  桂纶镁  跨界鼎力推荐,《西夏旅馆》是台湾中生代小说家骆以军迄今为止最为重要的作品，作者写作期间曾三度遭受忧郁症侵袭，最终耗时四年，倾力写就一部关于异族人、变形者的创伤与救赎、离散与追寻的疯癫、妖艳之书。,2010年，《西夏旅馆》荣获华文世界奖金最高的文学奖项“红楼梦奖”首奖，复旦大学陈思和教授在颁奖词中如此陈述：《西夏旅馆》以十一世纪神秘消失的西夏王朝作为历史托喻，以一座颓废怪诞的旅馆作为空间符号，写出一部关于创伤与救赎、离散与追寻的传奇故事。骆以军糅合私密告白与国族叙事，魔幻现实与情欲臆想，黑色幽默与感伤格调，铺陈现代中国经验最复杂的面貌。全书试探文学想象的禁区、人间伦理关系的极限，尤其值得瞩目。《西夏旅馆》文字华丽，结构繁复，意象奇诡，寄托深远，为新世纪华文小说所仅见。,本书获奖记录：,2008 《中国时报》开卷好书奖,2008 《亚洲周刊》年度十大中文小说,2009  台湾文学奖小说金典奖,2009  第33届“金鼎奖”图书类最佳著作人奖,2010  第3届“红楼梦奖”世界华人长篇小说奖,推荐语：,骆以军是最近台湾十多年来最了不起、最有创造力的一位作家，而且甚至是整个华文世界里面最有重量的作家之一。……《西夏旅馆》在骆以军怪异、绚丽、有点色情意味的笔下，透露了外省第二代的漂流经验。,――王德威,这不是一部易懂的小说，但它是骆以军语言技艺的大成，更有可能是华文小说的新路碑。若要我用一句话去总结，我只能勉强地说：“西夏”在骆以军笔下成了一切历史中曾经灿烂登场却又终归灰灭的记忆之象征，“旅馆”乃是容纳无穷故事但又不可一一说完的迷宫装置，其奇诡复杂让人叹为观止。如果这是台湾中生代作家对小说提出的疑问和挑战，大陆这边又有哪一个同代人愿意去接应回答？,――梁文道,骆以军是个蛮横的蠢孩子，他具有极大的破坏力，把现有的时空砸个稀巴烂，再把齑粉般的碎片凑起来，搭一个莫须有的新时空，好歹拼成个四不像，却找不到进去的路径。正彷徨着，忽然蹈入一扇门，又陌生又熟悉，既不是砸烂的那一个，也不是新凑的这一个，而是第三个，叫做“西夏旅馆”。,――王安忆,这是一部庞杂的书，也是一部匠心独运的书。这是一部琐碎的写实之书，也是一部超越了现实生活的象征之书。这是一部让读者望之却步的书，也是一部让读者手不释卷的书。,――莫言,长辈不在的时候，我们都称骆以军为台湾文坛一哥，六以降第一人。,――戴立忍,作家翻箱倒柜将一幕幕荒谬乖离的末世景象以无比温柔的笔触结印。自脱稿那日, 便注定是一部跨世纪、 跨古今与两岸的文学巨著。,――桂纶镁",骆以军
 8.5 ,追随她的旅程,https://book.douban.com/subject/3406518/,一群少年快乐、自然、诗意、燥闷的成长往事。路小路、杨一、于小奇、曾园，虽然出生、经历各不相同，但在1990年的夏天，在戴城这个闭塞的小城，他们都有着逃离此地的欲望，都开始了对未来和爱情的追寻，他们遭遇到的挫折如此相似，他们的迷茫和失败也近乎相同。他们相遇，继而相离，期间夹杂温柔的暴力，克制却感人肺腑的爱情故事，还有最诚挚的兄弟之情。,路内
rate,tittle,link,content_intro,author_intro
 8.8 ,悲伤与理智,https://book.douban.com/subject/26264154/,"在这部题材丰富、视界浩淼的散文集中，约瑟夫?布罗茨基开篇便用深沉内省的目光审视了自己在苏俄的早年经历以及随后去往美国的流亡生涯。接着，作者用惊人的博学探讨了诗歌的张弛变幻、历史的本质、流亡诗人的双重困境等一系列颇具广度与深度的话题，思维的触手延揽古今，上及古罗马贤帝马可?奥勒留， 下至现当代诗人托马斯?哈代与罗伯特?弗罗斯特，将对存在本质的哲学探讨与对诗歌美学的炽烈情愫糅合锻造为继《小于一》之后的又一部世所罕见的奇作。,收入文集的二十一篇散文大致分为回忆录、旅行记、演说讲稿、公开信和悼文等几种体裁。这些散文形式多样，长短不一，但它们诉诸的却是一个共同的主题，即“诗和诗人”。这卷文集可以说是通向布罗茨基的诗歌观和美学观，乃至他的伦理观和世界观的一把钥匙。文集中最后一篇作品《悼斯蒂芬・斯彭德》完成后不到半年，布罗茨基自己也离开了人世，《悲伤与理智》因此也...,在这部题材丰富、视界浩淼的散文集中，约瑟夫?布罗茨基开篇便用深沉内省的目光审视了自己在苏俄的早年经历以及随后去往美国的流亡生涯。接着，作者用惊人的博学探讨了诗歌的张弛变幻、历史的本质、流亡诗人的双重困境等一系列颇具广度与深度的话题，思维的触手延揽古今，上及古罗马贤帝马可?奥勒留， 下至现当代诗人托马斯?哈代与罗伯特?弗罗斯特，将对存在本质的哲学探讨与对诗歌美学的炽烈情愫糅合锻造为继《小于一》之后的又一部世所罕见的奇作。,收入文集的二十一篇散文大致分为回忆录、旅行记、演说讲稿、公开信和悼文等几种体裁。这些散文形式多样，长短不一，但它们诉诸的却是一个共同的主题，即“诗和诗人”。这卷文集可以说是通向布罗茨基的诗歌观和美学观，乃至他的伦理观和世界观的一把钥匙。文集中最后一篇作品《悼斯蒂芬・斯彭德》完成后不到半年，布罗茨基自己也离开了人世，《悲伤与理智》因此也就成了布罗茨基生前出版的最后一部散文集，是布罗茨基散文写作、乃至其整个创作的“天鹅之歌”。,上海译文出版社此次翻译出版的《悲伤与理智》是这部佳作的首个国内中文译本，在翻译文学界具有填补空白的重大意义以及不可替代的文学与学术价值。",[美] 约瑟夫・布罗茨基
 9.2 ,一九八四・动物农场,https://book.douban.com/subject/1082387/,《一九八四》和《动物农场》是奥威尔的传世之作，堪称世界文坛上最著名的政治讽喻小说。他在小说中他创造的“老大哥”、“双重思想”、“新话”等词汇都已收入权威的英语词典，甚至由他的姓衍生了一个形容词“奥威尔式”不断出现在报道国际新闻的记者笔下，足见其作品在英语国家影响之深远。“多一个人看奥威尔，就多了一份自由的保障”，有评家如是说。,[英] 乔治・奥威尔
 9.3 ,时间之间,https://book.douban.com/subject/26756030/,"编辑推荐,莎士比亚辞世400周年（1616～2016），全球顶尖当代小说家联手改写莎翁七部经典剧作致敬！2016“莎士比亚年”全球联手打造的出版盛举，惠特布雷德首作奖得主、英国天才女作家、全球畅销书《橘子不是唯一的水果》作者珍妮特・温特森重磅首发，担纲改写《冬天的故事》这一莎翁晚年重要剧作，引发28国上千万读者热评。《纽约时报》《泰晤士报》《卫报》《金融时报》《星期日邮报》《出版人周刊》《观察家报》等携手推荐，《纽约时报》评价它是“一部闪耀着喜悦之光的小说”。国内新锐文艺阅读品牌“未读”与企鹅兰登（北亚）联手，全球独家呈现简体中文版《时间之间》。――时间抚平一切伤痛，我们终将被它捕获。,内容简介,刚出生的帕蒂塔被遗弃在医院的“婴儿岛”里。她是被亲生父亲列奥以“送回她亲生父亲那里”的名义带离父母身边的，但一场意外的发生使她从未抵达。帕蒂塔成了列奥狂热嫉...,编辑推荐,莎士比亚辞世400周年（1616～2016），全球顶尖当代小说家联手改写莎翁七部经典剧作致敬！2016“莎士比亚年”全球联手打造的出版盛举，惠特布雷德首作奖得主、英国天才女作家、全球畅销书《橘子不是唯一的水果》作者珍妮特・温特森重磅首发，担纲改写《冬天的故事》这一莎翁晚年重要剧作，引发28国上千万读者热评。《纽约时报》《泰晤士报》《卫报》《金融时报》《星期日邮报》《出版人周刊》《观察家报》等携手推荐，《纽约时报》评价它是“一部闪耀着喜悦之光的小说”。国内新锐文艺阅读品牌“未读”与企鹅兰登（北亚）联手，全球独家呈现简体中文版《时间之间》。――时间抚平一切伤痛，我们终将被它捕获。,内容简介,刚出生的帕蒂塔被遗弃在医院的“婴儿岛”里。她是被亲生父亲列奥以“送回她亲生父亲那里”的名义带离父母身边的，但一场意外的发生使她从未抵达。帕蒂塔成了列奥狂热嫉妒的牺牲品，嫉妒的对象是他最爱的两个人――竭力要全身心占有的挚爱、有孕在身的妻子咪咪，和他少年时的恋人、终生的朋友赛诺。他觉得咪咪和赛诺有染。,伤害常常只留给最爱的人。且以爱之名。,对帕蒂塔的人生来说，时空就此错位。从出生到十八岁，从伦敦到新波西米亚。她更是从未想过，被时空裂隙吞没的自己，是一切救赎的希望所系……,媒体评论,NPR（美国国家公共电台）年度最佳图书,温特森杰出的天赋在于，通过那些浅吟低唱般优美、常在意料之外迅捷而至的句子，成功地传达出小说的情感分量……她与令人费解的文本之间展开了一场奇妙的搏斗，最终呈现出一个错综复杂的、让人拍案叫好的当代故事――属于她自己的全新故事。――《纽约时报书评》,如同莎士比亚一样，温特森笔下的舞台上，处处充满了奇迹。――《泰晤士报文学增刊》,温特森不仅仅是改写了一个故事――她还将自己细致入微的心理感受填充进了这个故事中。观察温特森如何解决原剧本的问题固然有趣，但这本书真正的力量在于，她在时而朴实时而诗意的语言风格之间自由切换，并用任何她想用的元素（天使、游戏、劫车等）来阐述故事的能力。她让一个旧故事焕发出了新的生机。――《出版人周刊》,对于莎翁创作生涯的倒数第二个剧本而言，温特森的改写有着可爱的轻快节奏，聪敏而诙谐，故事情节引人入胜……小说让人充满了同情，并在一个众所熟知的故事里注入了一种真正的惊险感，而这绝非易事。它如此引人注目、有趣且优美。――《卫报》",[英] 珍妮特・温特森
 9.0 ,局外人,https://book.douban.com/subject/4908885/,《局外人》是加缪小说的成名作和代表作之一，堪称20世纪整个西方文坛最具有划时代意义最著名小说之一，“局外人”也由此成为整个西方文学-哲学中最经典的人物形象和最重要的关键词之一。,[法] 阿尔贝・加缪
 8.9 ,斯通纳,https://book.douban.com/subject/26425831/,"《斯通纳》讲述了生命中最重要的部分：爱，认同，怜悯，志业，傲骨，信任与死亡。,一个勇者有过的失败不失意的人生：即使不能拥有完美的生活，所幸追求过完整的自我。,美国，密苏里州。来自偏远农场的农家子弟、19岁的威廉・斯通纳进入州立密苏里大学学习农学。自一堂选修文学课为起点， 他的一生就此悄然改变。未来的斯通纳成为了一名大学老师，结婚、生子、教学、退休、衰老、死亡。在他生命的尽头，或许他可以坦然面对这个问题：你的一生，还要期望别的什么吗？,一部蕴含着真诚、激情与紧凑力量的小说，探究了历史洪流所忽视的人性之间的冲突、溃败与幸存，重新唤起思考每个个体独特存在的意义。作者约翰・威廉斯向世人展示了凡人中的勇者在如何生活。,----------------------------------------,威廉斯的写作显得澄澈、节制却准确。就像被打磨光滑的橡木上反射出...,《斯通纳》讲述了生命中最重要的部分：爱，认同，怜悯，志业，傲骨，信任与死亡。,一个勇者有过的失败不失意的人生：即使不能拥有完美的生活，所幸追求过完整的自我。,美国，密苏里州。来自偏远农场的农家子弟、19岁的威廉・斯通纳进入州立密苏里大学学习农学。自一堂选修文学课为起点， 他的一生就此悄然改变。未来的斯通纳成为了一名大学老师，结婚、生子、教学、退休、衰老、死亡。在他生命的尽头，或许他可以坦然面对这个问题：你的一生，还要期望别的什么吗？,一部蕴含着真诚、激情与紧凑力量的小说，探究了历史洪流所忽视的人性之间的冲突、溃败与幸存，重新唤起思考每个个体独特存在的意义。作者约翰・威廉斯向世人展示了凡人中的勇者在如何生活。,----------------------------------------,威廉斯的写作显得澄澈、节制却准确。就像被打磨光滑的橡木上反射出本色、持久的光泽。它的行文结构潜藏得不为人察觉，且毫无瑕疵，像一栋房子，精妙绝伦到绝无仿制再建的可能。,《斯通纳》一书的伟大之处在于，它以不带一丝一毫悲喜的冷静洞察了生活本质的全部。它从本质上触及了预见期待的与真实体验的生活间的落差……《斯通纳》迟到五十年后畅销，是献给被亏欠的艺术一次迟来的正名。 ――《纽约客》,斯通纳活过，然后死去，如你我一样。他生活中发生的每一件事就发生在你我面前，看似平淡。然而，写出这种“简单”却需要天才才能完成。读这本书是一本令人难过却又美妙的阅读体验。 ――《星期日泰晤士报》,约翰・威廉斯的《斯通纳》刻画了一个将追求智识当作对抗无意义的战争、拒绝与外部世界作廉价妥协的人的一生。它的意义或许不只是一部伟大的小说――它简直是一部几近完美的小说，机构精巧，语言优美，故事动人，展示着一种夺人心魄的完美。 ――《纽约时报》,一件文学的珍宝。 ――《明镜周刊》,拥有超乎寻常的力量……直击生活的真相，语言清澈优美。它是一部献给所有热爱文学之人的传奇。 ――伊恩・麦克尤恩,一本精彩绝伦的小说，既丰富又忧郁，记录着伤痛与失去的同时也留存了美好温柔的时刻。这本小说完美展现了小说艺术的要素，它的叙事节奏与情节构架均堪称完美无缺。这本小说像一条河流，冷静而又流畅的平静笔调裹挟着磅礴延绵的力量。 ――亚当・福尔兹",[美] 约翰・威廉斯
 8.8 ,我脑袋里的怪东西,https://book.douban.com/subject/26701959/,"◆ 诺贝尔文学奖得主、《我的名字叫红》《伊斯坦布尔》作者奥尔罕?帕慕克 蛰伏六年动情写就 全球60个语种正在流行。,◆斩获诺奖之后还能写出自己的最佳作品，帕慕克就是这样的大师。――《独立报》,◆让一千万人聚集在伊斯坦布尔的东西是生计、利益和账单，但只有一样东西支撑着这茫茫人海中的人们，那就是爱。,◆嘈杂腐败而又日新月异的城市史诗，天真、正派又卑微的街边小贩的人生传奇。,《我脑袋里的怪东西》是一个讲述钵扎小贩麦夫鲁特的人生、 冒险、幻想和他的朋友们的故事,同时也是一幅通过众人视角描绘的 1969―2012年间伊斯坦布尔生活的画卷。,在麦夫鲁特还是一个生活在安纳托利亚中部穷山村少年的时候，他就不住地幻想自己未来的生活会是怎样。,十二岁时他辗转来到“世界的中心”――伊斯坦布尔打拼，立刻被那些老城消逝、新城待建的景象所吸引。他继承了父亲的事业，在土耳其的街道...,◆ 诺贝尔文学奖得主、《我的名字叫红》《伊斯坦布尔》作者奥尔罕?帕慕克 蛰伏六年动情写就 全球60个语种正在流行。,◆斩获诺奖之后还能写出自己的最佳作品，帕慕克就是这样的大师。――《独立报》,◆让一千万人聚集在伊斯坦布尔的东西是生计、利益和账单，但只有一样东西支撑着这茫茫人海中的人们，那就是爱。,◆嘈杂腐败而又日新月异的城市史诗，天真、正派又卑微的街边小贩的人生传奇。,《我脑袋里的怪东西》是一个讲述钵扎小贩麦夫鲁特的人生、 冒险、幻想和他的朋友们的故事,同时也是一幅通过众人视角描绘的 1969―2012年间伊斯坦布尔生活的画卷。,在麦夫鲁特还是一个生活在安纳托利亚中部穷山村少年的时候，他就不住地幻想自己未来的生活会是怎样。,十二岁时他辗转来到“世界的中心”――伊斯坦布尔打拼，立刻被那些老城消逝、新城待建的景象所吸引。他继承了父亲的事业，在土耳其的街道上贩卖钵扎。他与那些在城市繁华外荒凉处的居民一样，渴望致富。但是运气似乎永远都不追随他，他看着亲戚们在伊斯坦布尔暴富并定居；而自己却花了三年时间给一位仅在婚礼上有过一面之缘的女孩儿写情书，最后却阴差阳错地和那女孩儿的姐姐私奔。麦夫鲁特人到中年，在伊斯坦布尔的街巷里做过许多营生，酸奶小贩、鹰嘴豆鸡肉饭小贩、停车场管理员……,他珍惜自己的家人和妻子，可工作失意、生活窘迫仍不断挤压着他。无论如何，他仍然夜复一夜，漫步在伊斯坦布尔街头，一边卖钵扎，思念自己的真爱，一边琢磨着脑袋里冒出的一个又一个怪怪的东西，这些念头让他自感与众不同。他，一个没钱没地位的钵扎贩子，既属于这个大都市，又在头脑中不停地寻找着另一种生活。",[土耳其] 奥尔罕・帕慕克
 9.0 ,月亮和六便士,https://book.douban.com/subject/1858513/,"一个英国证券交易所的经纪人，本已有牢靠的职业和地位、美满的家庭，但却迷恋上绘画，像“被魔鬼附了体”，突然弃家出走，到巴黎去追求绘画的理想。他的行径没有人能够理解。他在异国不仅肉体受着贫穷和饥饿煎熬，而且为了寻找表现手法，精神亦在忍受痛苦折磨。经过一番离奇的遭遇后，主人公最后离开文明世界，远遁到与世隔绝的塔希提岛上。他终于找到灵魂的宁静和适合自己艺术气质的氛围。他同一个土著女子同居，创作出一幅又一幅使后世震惊的杰作。在他染上麻风病双目失明之前，曾在自己住房四壁画了一幅表现伊甸园的伟大作品。但在逝世之前，他却命令土著女子在他死后把这幅画作付之一炬。通过这样一个一心追求艺术、不通人性世故的怪才，毛姆探索了艺术的产生与本质、个性与天才的关系、艺术家与社会的矛盾等等引人深思的问题。同时这本书也引发了人们对摆脱世俗束缚逃离世俗社会寻找心灵家园这一话题的思考，而关...,一个英国证券交易所的经纪人，本已有牢靠的职业和地位、美满的家庭，但却迷恋上绘画，像“被魔鬼附了体”，突然弃家出走，到巴黎去追求绘画的理想。他的行径没有人能够理解。他在异国不仅肉体受着贫穷和饥饿煎熬，而且为了寻找表现手法，精神亦在忍受痛苦折磨。经过一番离奇的遭遇后，主人公最后离开文明世界，远遁到与世隔绝的塔希提岛上。他终于找到灵魂的宁静和适合自己艺术气质的氛围。他同一个土著女子同居，创作出一幅又一幅使后世震惊的杰作。在他染上麻风病双目失明之前，曾在自己住房四壁画了一幅表现伊甸园的伟大作品。但在逝世之前，他却命令土著女子在他死后把这幅画作付之一炬。通过这样一个一心追求艺术、不通人性世故的怪才，毛姆探索了艺术的产生与本质、个性与天才的关系、艺术家与社会的矛盾等等引人深思的问题。同时这本书也引发了人们对摆脱世俗束缚逃离世俗社会寻找心灵家园这一话题的思考，而关于南太平洋小岛的自然民风的描写也引人向往。,《月亮和六便士》说问世后，以情节入胜、文字深刻在文坛轰动一时，人们争相传看。在小说中，毛姆用第一人称的叙述手法，借“我”之口，叙述整个故事，有人认为这篇小说的原型是法国印象派画家高更，这更增加了它的传奇色彩，受到了全世界读者的关注。",[英] 毛姆
