rate,tittle,link,content_intro,author_intro
 8.8 ,阿尔伯特・卡埃罗,https://book.douban.com/subject/24856615/,"必须将佩索阿的名字列入生于〔19世纪〕80年代的世界级艺术家这个群体：毕加索、乔伊斯、勃拉克、斯特拉文斯基、赫列勃尼科夫、勒?柯布西埃……,――罗曼?雅各布森（俄国形式主义代表人物）,佩索阿是本世纪最具决定意义的诗人之一 ，如果我们把他看作一种哲学上的可能性的话就尤为如此。 ――阿兰?巴G,我们相信阿尔伯特?卡埃罗是20世纪最伟大的诗人之一。他落寞地生活，无名地死去。在神秘主义者看来，这是导师的特征。,――里卡多?雷耶斯（佩索阿异名之一）,根据研究者统计，佩索阿一生共创造了72个不同的异名。这72个异名承担着不同的职责，活跃程度不尽相同，最主要的异名有三个：阿尔伯特?卡埃罗，阿尔瓦罗?德?冈波斯与里卡多?雷耶斯，他们与本名的费尔南多?佩索阿共同构成了一个书写的“家族”。《阿尔伯特?卡埃罗》所收作品即是佩索阿以这个异名写作的诗歌和散文。,本书中第一部分...,必须将佩索阿的名字列入生于〔19世纪〕80年代的世界级艺术家这个群体：毕加索、乔伊斯、勃拉克、斯特拉文斯基、赫列勃尼科夫、勒?柯布西埃……,――罗曼?雅各布森（俄国形式主义代表人物）,佩索阿是本世纪最具决定意义的诗人之一 ，如果我们把他看作一种哲学上的可能性的话就尤为如此。 ――阿兰?巴G,我们相信阿尔伯特?卡埃罗是20世纪最伟大的诗人之一。他落寞地生活，无名地死去。在神秘主义者看来，这是导师的特征。,――里卡多?雷耶斯（佩索阿异名之一）,根据研究者统计，佩索阿一生共创造了72个不同的异名。这72个异名承担着不同的职责，活跃程度不尽相同，最主要的异名有三个：阿尔伯特?卡埃罗，阿尔瓦罗?德?冈波斯与里卡多?雷耶斯，他们与本名的费尔南多?佩索阿共同构成了一个书写的“家族”。《阿尔伯特?卡埃罗》所收作品即是佩索阿以这个异名写作的诗歌和散文。,本书中第一部分呈现了阿尔伯特?卡埃罗的组诗《守羊人》，这是一部具有奠基性质的作品。组诗共有49首，但实际上可以看成是一首诗，或者一句话：世界是部分，而非整体。以基督一神论为信仰基础的理性精神要求现代人把“自然”作为整体来认识，而不是石头、河流与树木无休无止的相加。而佩索阿认为这种理性阻碍人们正确认识自然。因此，为了重建异教，或者建立新异教，首先要通过消灭绝对理性与拒绝形而上学重现异教的本质。,《恋爱中的牧羊人》，是一组阿尔伯特?卡埃罗诗陷入爱情时的诗作，是恋爱中的阿尔伯特?卡埃罗对待爱情的自然而然的方式。,《未结之诗》，阿尔伯特?卡埃罗的早期诗作，并与其他所有诗作归并在一起出版，这些诗中的最后几首（从（……）号起）是卡埃罗临终之前回到里斯本写出的。由于疾病的侵袭，诗人最后的诗作呈现出某种新奇，无论性质还是方向上，都与作品的总体特征有所区别。,最后还有《断章》、《归属不明的诗》三首，以及散文部分的《阿尔伯特?卡埃罗访谈》及一篇论及诗歌和散文区别的小品。并附有费尔南多?佩索阿大事年谱。",[葡萄牙]费尔南多・佩索阿
 7.7 ,少年维特的烦恼,https://book.douban.com/subject/1047138/,小说的情节十分简单，年轻的维特来到一个小镇，这里的自然风光、淳朴的民风、天真快乐的儿童给予他极大的快乐。一次舞会上他认识了一个叫绿蒂的少女，她的一颦一笑、一举一动都让他倾倒；绿蒂也喜欢他，却不能予以爱的回报，她已与维特好友订婚。维特陷入了尴尬和痛苦，他毅然离开此地，力图从事业上得到解脱，有所成就，然而鄙陋的环境、污浊的人际关系、压抑个性窒息自由的现存秩序，都使他无法忍受，当他怀才不遇地重返绿蒂身边时，发现绿蒂已结婚，决定以死殉情，遂用一支手枪结束了自己的生命。,[德] 歌德
 7.9 ,恋爱中的骗子,https://book.douban.com/subject/6041086/,"《恋爱中的骗子》是理查德・耶茨继《十一种孤独》之后的第二部短篇小说集，共收入七个短篇。它完美地展示了耶茨高人一等的洞察力和描述力。耶茨借由本书再次证明了短篇小说的力量。显然更有兴趣描写“失败人生”的耶茨，凭借他敏锐的心灵与独到的观察角度，仿佛拼贴艺术般，将美国“小人物”及其生活片断立体地展现在我们眼前：失败的艺术家、生活艰难的单身母亲、疏离的亲情、劳燕分飞的婚姻、叛逆的女儿、转瞬即逝的情事、不可靠的梦想……,被遗忘的最优秀的美国作家。,――《泰晤士报》,耶茨悲天悯人的力量和敏锐的观察力使这部作品脱颖而出成一个文学大事件……令人瞩目的成就。,――《独立报》,这是二战后一位伟大却被忽视的美国作家令人难忘却长期被遗忘的作品。,――《新政治家》,耶茨是一位杰出的现实主义作家……让人边阅读边流泪。,――《卫报》",[美] 理查德・耶茨
 8.3 ,抛锚,https://book.douban.com/subject/20559350/,"迪伦马特善于采用悬疑、荒诞的手法讽刺、批判社会现实。《抛锚》从迪伦马特富有艺术特色、极具审美价值的中短篇小说中精选了七篇，既包括享誉世界的《隧道》《狗》《抛锚》等名作，也有首度翻译成中文的杰作《坠亡》《阿布?夏尼法和阿南?本?大卫》《女预言家之死》等。,革命者认为可以通 过政治改变社会，并且相信自己掌握了能改变社会的政治法则。反抗者却认为，人类本身就是一个庞大的怪胎，只有通过对这种怪胎的认识才能对此加以补救。而我的艺术就是这种反抗的一种表达方式。,――弗里德里希・迪伦马特",[瑞士]弗里德里希・迪伦马特
 8.4 ,小妇人,https://book.douban.com/subject/1427288/,"这部小说以家庭生活为描写对象，以家庭成员的感情纠葛为线索，描写了马奇一家的天伦之爱。马奇家的四姐妹中，无论是为了爱情甘于贫困的海格，还是通过自己奋斗成为作家的乔，以及坦然面对死亡的贝思和以扶弱为己任的艾米，虽然她们的理想和命运都不尽相同，但是她们都具有自强自立的共同特点。描写了她们对家庭的眷恋；对爱的忠诚以及对亲情的渴望。,马奇一家有四个姐妹，生活清贫、简单而又温馨。四组妹性格迥异；老大梅格漂亮端庄，有些爱慕虚荣；老二乔自由独立，渴望成为作家，老三贝丝善良羞涩，热爱音乐，老四埃米聪慧活泼，爱好艺术，希望成为一名上流社会的“淑女”。,所有时代的所有少女成长过程中所要面对的经历的，都可以在这本书中找到：初恋的甜蜜和烦恼，感情与理智的译，理想和现实的差距，贫穷与富有的矛盾。,《小妇人》故事情节简单真实，却感人至深，问世一百多年以来，多次被般上银幕，并被译成...,这部小说以家庭生活为描写对象，以家庭成员的感情纠葛为线索，描写了马奇一家的天伦之爱。马奇家的四姐妹中，无论是为了爱情甘于贫困的海格，还是通过自己奋斗成为作家的乔，以及坦然面对死亡的贝思和以扶弱为己任的艾米，虽然她们的理想和命运都不尽相同，但是她们都具有自强自立的共同特点。描写了她们对家庭的眷恋；对爱的忠诚以及对亲情的渴望。,马奇一家有四个姐妹，生活清贫、简单而又温馨。四组妹性格迥异；老大梅格漂亮端庄，有些爱慕虚荣；老二乔自由独立，渴望成为作家，老三贝丝善良羞涩，热爱音乐，老四埃米聪慧活泼，爱好艺术，希望成为一名上流社会的“淑女”。,所有时代的所有少女成长过程中所要面对的经历的，都可以在这本书中找到：初恋的甜蜜和烦恼，感情与理智的译，理想和现实的差距，贫穷与富有的矛盾。,《小妇人》故事情节简单真实，却感人至深，问世一百多年以来，多次被般上银幕，并被译成各种文字，成为世界文学宝库中的经典名作。书中描写的种种情感体验和生活经历，都曾经、正在并将要发生在每一个少女走向成熟的过程之中；书中提倡善良、忠诚、无私、慷慨、尊严、宽容、坚韧、勇敢、亦是人类永远尊崇和追求的美德和信低仰。所有这些，赋予这本书超赵时代和国度的生命力，这也正是她成为不朽的典的魅力和原因所在。",（美）路易莎?梅?奥尔科特
 8.2 ,米沃什词典,https://book.douban.com/subject/1050951/,"“我们这个时代最伟大的诗人之一”、1980诺贝尔文学奖得主切斯瓦夫?米沃什的人生回忆录，呈现20世纪历史文化广阔的精神地图。,1940年6月，29岁的切斯瓦夫・米沃什闯过苏军与德军四道防线，从维尔诺长途跋涉到纳粹占领下的华沙。半个多世纪流亡生涯之后，他才终于重返故乡维尔诺，一座“从童话中长出来的城市”。与自己的过去重逢，他回到一种间接的自我表达方式，开始为各种历史人物事件登记造册，而不是谈论他 自己。,《米沃什词典》就是这样一件替代品。它替代了一部长篇小说，一篇关于整个20世纪的文章，一部回忆录。书中所记的每一个人，都在一个网络中活动，相互阐释，相互依赖，并与20世纪的某些史实相关联。,《米沃什词典》是米沃什亲自经历与见证的20世纪。与他一起到过人间的天堂或地狱的人，几乎都已去了幽灵王国。本书是对那些灵魂的召唤，以文学这一永恒的纪念仪式，换取他们的片...,“我们这个时代最伟大的诗人之一”、1980诺贝尔文学奖得主切斯瓦夫?米沃什的人生回忆录，呈现20世纪历史文化广阔的精神地图。,1940年6月，29岁的切斯瓦夫・米沃什闯过苏军与德军四道防线，从维尔诺长途跋涉到纳粹占领下的华沙。半个多世纪流亡生涯之后，他才终于重返故乡维尔诺，一座“从童话中长出来的城市”。与自己的过去重逢，他回到一种间接的自我表达方式，开始为各种历史人物事件登记造册，而不是谈论他 自己。,《米沃什词典》就是这样一件替代品。它替代了一部长篇小说，一篇关于整个20世纪的文章，一部回忆录。书中所记的每一个人，都在一个网络中活动，相互阐释，相互依赖，并与20世纪的某些史实相关联。,《米沃什词典》是米沃什亲自经历与见证的20世纪。与他一起到过人间的天堂或地狱的人，几乎都已去了幽灵王国。本书是对那些灵魂的召唤，以文学这一永恒的纪念仪式，换取他们的片刻显形。他用词典这一相对客观、抽离、高度浓缩的形式，以平静、卓越的才智，将他的时代丰富层面的体验，浓缩为一个个充满高度智性和深沉情感的词条。",[波兰] 切斯瓦夫・米沃什
 8.3 ,44号孩子,https://book.douban.com/subject/4870150/,"这是一个被宣称没有犯罪的天堂，但生活在“天堂”里的人们却不知道，自己何时就会跌入地狱。里奥，“天堂”最忠诚、勇敢的卫士，为了它，可以奉献自己的生命，为了它，可以奉献别人的生命。然而，在目睹了无辜的人被审讯，自己的妻子受到牵连，甚至一个又一个年幼的生命暴尸荒野，国家却坚决不承认这是犯罪之后，他的信念发生崩塌！他决定不顾一切寻求真相，过程中，他惊讶地发现，真正的危险不是来自谋杀者，而是来自他一心保护的国家……,在这个彼此怀疑、人人自危，随时面临生存危险的残酷世界里，主人公里奥经历了命运的大翻转，迷失的自我慢慢觉醒。因为44号孩子，他看到了他一直忠诚效命的国家的真相；因为44号孩子，他得以窥破他与妻子关系的真相；因为44号孩子，他看到了自己一直不愿正视的与家人关系的真相。,其实救赎，也是自救。",[英] 汤姆・罗伯・史密斯
 8.5 ,帕洛马尔,https://book.douban.com/subject/1870262/,化身为帕洛马尔的卡尔维诺，将他对世界的最后沉思，掩映在叙述中，穿透了人生的全部经验，小说出版一年后，因卡尔维诺溘然长逝而成为绝响，意味深长的是《帕洛马尔》的最后一章完全记叙的是主人公对死亡的沉思默想。,[意大利] 伊塔洛・卡尔维诺
 8.2 ,每个人都死了,https://book.douban.com/subject/3215515/,"《每个人都死了》一书是米基・巴鲁的故事。《每个人都死了》一书是米基・巴鲁的故事。米基・巴鲁是地狱厨房葛洛根酒吧的幕后老板，爱尔兰裔的职业性罪犯，据史卡德描述，他巨大、凶悍，像花岗岩粗凿两下而成的，是活生生的复活岛巨人像。米基・巴鲁是地狱厨房葛洛根酒吧的幕后老板，爱尔兰裔的职业性罪犯，据史卡德描述，他巨大、凶悍，像花岗岩粗凿两下而成的，是活生生的复活岛巨人像。,史卡德和他结识于《刀锋之先》一案中，于是，代表法律的前警员侦探遂和代表反法律的恶徒成为莫逆之交，他们总在葛洛根酒吧坐一整夜，米基喝他十二年的爱尔兰威士忌，为史卡德准备一壶好咖啡，谈到东方既白，再一起到圣本纳德教堂望弥撒。史卡德和他结识于《刀锋之先》一案中，于是，代表法律的前警员侦探遂和代表反法律的恶徒成为莫逆之交，他们总在葛洛根酒吧坐一整夜，米基喝他十二年的爱尔兰威士忌，为史卡德准备一壶好咖啡，...,《每个人都死了》一书是米基・巴鲁的故事。《每个人都死了》一书是米基・巴鲁的故事。米基・巴鲁是地狱厨房葛洛根酒吧的幕后老板，爱尔兰裔的职业性罪犯，据史卡德描述，他巨大、凶悍，像花岗岩粗凿两下而成的，是活生生的复活岛巨人像。米基・巴鲁是地狱厨房葛洛根酒吧的幕后老板，爱尔兰裔的职业性罪犯，据史卡德描述，他巨大、凶悍，像花岗岩粗凿两下而成的，是活生生的复活岛巨人像。,史卡德和他结识于《刀锋之先》一案中，于是，代表法律的前警员侦探遂和代表反法律的恶徒成为莫逆之交，他们总在葛洛根酒吧坐一整夜，米基喝他十二年的爱尔兰威士忌，为史卡德准备一壶好咖啡，谈到东方既白，再一起到圣本纳德教堂望弥撒。史卡德和他结识于《刀锋之先》一案中，于是，代表法律的前警员侦探遂和代表反法律的恶徒成为莫逆之交，他们总在葛洛根酒吧坐一整夜，米基喝他十二年的爱尔兰威士忌，为史卡德准备一壶好咖啡，谈到东方既白，再一起到圣本纳德教堂望弥撒。史卡德和米基的漫漫长夜对话，一直是史卡德系列中最深沉的一幕。史卡德和米基的漫漫长夜对话，一直是史卡德系列中最深沉的一幕。米基在纽约市里市外，拥有不少产业和生意，但他的名字从不出现在正式文件上，他说，“当你不拥有，他们就不容易从你手上拿走。”米基在纽约市里市外，拥有不少产业和生意，但他的名字从不出现在正式文件上，他说，“当你不拥有，他们就不容易从你手上拿走。”,米基是屠夫之后，他保留了父亲遗留给他的屠刀和围裙，屠刀锋利如他父亲执业之时，围裙则溅满昔日的牲畜之血和现在的人们之血，当米基准备动手杀人时，他总会系上这件染血的白围裙。米基是屠夫之后，他保留了父亲遗留给他的屠刀和围裙，屠刀锋利如他父亲执业之时，围裙则溅满昔日的牲畜之血和现在的人们之血，当米基准备动手杀人时，他总会系上这件染血的白围裙。他最骇人听闻的事迹是，他曾手刃一个名为佩迪・法雷利的仇家，用屠刀切下脑袋，装入个保龄球袋之中，并巡行该区所有酒吧，要所有人举杯祝福法雷利身体健康。他最骇人听闻的事迹是，他曾手刃一个名为佩迪・法雷利的仇家，用屠刀切下脑袋，装入个保龄球袋之中，并巡行该区所有酒吧，要所有人举杯祝福法雷利身体健康。",(美)劳伦斯・布洛克
 8.0 ,小城,https://book.douban.com/subject/4105439/,"约翰・布莱尔・克雷顿，一个正在突破边缘的作家；法兰西斯・巴克伦，前警察局长，下届市长候选人的热门人选，一个正在崩溃边缘的中年人；苏珊・波玛伦斯，一个美丽不可方物、品味脱俗的民俗艺术画廊老板，探索她深不可测的情欲世界；莫瑞・温特斯，一个老谋深算的刑案律师，偏好谋杀案，因为证人比较少；杰利・潘科，好不容易才从醉乡挣脱的清洁工，总是黎明即起，打扫这个城市的宿醉……,在9・11悲剧的阴影里，芸芸众生被一条看不见的绳索紧紧束缚。一个平凡的人，摇身变成杀人不眨眼的魔王，用最简单的武器，横眉冷对整个城市。",（美）劳伦斯・布洛克
 8.3 ,未来的序曲,https://book.douban.com/subject/26534892/,"《未来的序曲》是最新最权威的外国科幻选集。雨果奖最佳编辑严选34篇明星代表作，新世纪短篇科幻的饕餮盛宴！2位雨果奖最佳编辑，权威悉心严选。34位幻界新锐之星，代表作品大比拼。汇集目前最热的外国科幻作家，刘宇昆、保罗・巴奇加卢皮、约翰・斯卡尔齐、彼得・瓦茨、科利?多克托罗等等，星光灿烂一网打尽。,如今，科幻已经不再处于边缘地位，它已经是社会文化风貌中根深蒂固的一部分。这本选集中的所有故事都是在这样的背景下创作的。,完成这本书花了很长时间，本要在2010 年完成，在2011 或2012 年出版。但是，等待或许让这本书变得更棒了，因为更让编者有足够的时间好好思考。有理由相信，读者们也一定会在本书中发现许多值得欣赏、沉迷和争论的内容。",(美)刘宇昆，保罗・巴奇加卢皮等 著；(美)戴维・哈特威尔，帕特里克・海登 编
 7.9 ,刀锋之先,https://book.douban.com/subject/1986382/,"史卡德受到委ふ乙已失三星期的女孩，案情毫oM展，@女孩就像空庖拥南失o；同r戒酒f的朋友艾迪，在M腹心事聿患罢f出口的r下，被史卡德lF吊死在住。,「她愍往，可是不常待在她的套房公寓Y。她@N寂寞能去哪海克去公@，跟子f幔俊,史卡德受到委ふ乙已失三星期的女孩，案情毫oM展，@女孩就像空庖拥南失o；同r戒酒f的朋友艾迪，在M腹心事聿患罢f出口的r下，被史卡德lF吊死在住。,她到哪e去？他有什N与y以X的心事？史卡德能蜕隙嗌倜Γ,什N事情都可能l生，只能期待Y果不是太摹",劳伦斯・布洛克
 8.1 ,D^e的\,https://book.douban.com/subject/1775046/,,Lawrence Block
 8.6 ,蝙蝠b的褪,https://book.douban.com/subject/3052826/,"《蝙蝠b的褪帧芳Y了十篇R修．史卡德的短篇探案，闹校你可以回味《酒店PT之後》的故事源^，可以回到《刀h之先》拉自17痈下的F觯有他和老L官R哈菲理一杜e自⒁馔獾牟迩，以及其他各色各樱揭_R修．史卡德序幕的原c，是一本M入史卡德、重厥房ǖ碌淖罴堰x瘛,「我喜g透^R修．史卡德的眼睛砜催@世界，喜g通^R修．史卡德的感受碚f@世界。」,──斯?卜洛克,■本目,窗外,o袋D的一支T,黎明的第一道曙光,蝙蝠b的褪,慈悲的死亡天使,夜晚c音,ふ掖笮l,艋门萦,一r糊T,立於不≈地","斯・卜洛克,Lawrence Block"
 6.9 ,谭纳的两只老虎,https://book.douban.com/subject/20394511/,"《谭纳的两只老虎》内容简介：伊凡?麦可?谭纳是世界上形形色色隐秘组织的积极拥护者。朝鲜战场上的一枚碎弹片损坏了他的睡眠中枢，使他再也不用睡觉。谭纳喜欢追求无望的理想和女人，拥有超群的语言天赋和特殊的人脉，这使他成为极机密危险任务的不二人选。,谭纳总是会碰上新鲜事，好在他有大把时间去一一加以探索。这一次他只不过想带他的小女孩米娜――立陶宛逊位皇室的惟一后裔――去参观蒙特利尔的世界博览会，却卷入一连串的阴谋和恐怖计划中。加拿大皇家骑警、魁北克独立组织、古巴恐怖分子乃至不知名的美国情报机构都在找他的麻烦，更要命的是，他不仅参与策划了史上最大胆、最卑劣的刺杀行动，而且不得不在最短的时间内，亲手阻止它的发生……",(美)劳伦斯・布洛克
 7.1 ,梅开二度,https://book.douban.com/subject/21778492/,"奇普?哈里森回来了，回到了12月寒冷的纽约街头，依旧是乳臭未干，不名一文，身边没有女孩陪伴。他捡到一张“灰狗”车票，一张能兑成25美元现金的车票，不过他决定用这张车票到南卡罗莱纳试试运气。于是他发现自己来到了博登敦，在这个只有一条大街的镇子上他麻烦不断，历经一番努力终于征服了当地警长成了他的得意门生，找了一份妓院保镖的差事，还与牧师的女儿坠入爱河……命运仿佛在同他开玩笑，耗尽他的耐心和欲望之后才突然让快乐降临。此书讲述的就是这样一场追寻欢乐的探险，于险象环生里爆发出一个男孩的人生喜剧。,“不是说她们没有吸引力。她们已经够漂亮了，却是那种没任何意义的漂亮。我能想到解释这点的最好方式就是，你可以坐下来和她们聊上一小时左右，然后你离开屋子的时候，如果要想记住她们长什么样子，你会觉得有点困难。我想对一个妓女来说，这点倒是对她们有利的。我不知道。,不过问题是，...,奇普?哈里森回来了，回到了12月寒冷的纽约街头，依旧是乳臭未干，不名一文，身边没有女孩陪伴。他捡到一张“灰狗”车票，一张能兑成25美元现金的车票，不过他决定用这张车票到南卡罗莱纳试试运气。于是他发现自己来到了博登敦，在这个只有一条大街的镇子上他麻烦不断，历经一番努力终于征服了当地警长成了他的得意门生，找了一份妓院保镖的差事，还与牧师的女儿坠入爱河……命运仿佛在同他开玩笑，耗尽他的耐心和欲望之后才突然让快乐降临。此书讲述的就是这样一场追寻欢乐的探险，于险象环生里爆发出一个男孩的人生喜剧。,“不是说她们没有吸引力。她们已经够漂亮了，却是那种没任何意义的漂亮。我能想到解释这点的最好方式就是，你可以坐下来和她们聊上一小时左右，然后你离开屋子的时候，如果要想记住她们长什么样子，你会觉得有点困难。我想对一个妓女来说，这点倒是对她们有利的。我不知道。,不过问题是，玛丽?贝思，就是想要我车票的那个，已经让我总的来说对妓女没有什么想法了，跟有着诱人身材的妓女一起嬉戏的任何幻想再不能吸引我了。而且即使她们有什么想法，天哪，我每天晚上坐在那儿，这些姑娘们和男人们上楼，完事之后下来，打着哈欠，还拿刚才的事儿开玩笑。在很多方面，我都很喜欢她们，尤其是对克劳琳。她们两个人的大脑加起来，也抵不上一个相当聪明的女孩子的智商，但我就是喜欢她们。”",(美)劳伦斯・布洛克
